{
  "$schema": "../schemas/concept.schema.json",
  "id": "concept-medicine",
  "slug": "medicine",
  "name": "Medicine",
  "category": "medicine",
  "summary": "Clinical science and biomedical practice as systems of diagnosis and intervention.",
  "references": [],
  "connectedNodeIds": [
    "concept-human-systems",
    "concept-biology",
    "concept-ecg-generation"
  ],
  "layout": { "x": 0.22, "y": 0.28, "weight": 0.85 }
}
